userId,id,title,completed
1,4,et porro tempora,True
1,8,quo adipisci enim quam ut ab,True
1,10,illo est ratione doloremque quia maiores aut,True
1,11,vero rerum temporibus dolor,True
1,12,ipsa repellendus fugit nisi,True
1,14,repellendus sunt dolores architecto voluptatum,True
1,15,ab voluptatum amet voluptas,True
1,16,accusamus eos facilis sint et aut voluptatem,True
1,17,quo laboriosam deleniti aut qui,True
1,19,molestiae ipsa aut voluptatibus pariatur dolor nihil,True
1,20,ullam nobis libero sapiente ad optio sint,True
2,22,distinctio vitae autem nihil ut molestias quo,True
2,25,voluptas quo tenetur perspiciatis explicabo natus,True
2,26,aliquam aut quasi,True
2,27,veritatis pariatur delectus,True
2,30,nemo perspiciatis repellat ut dolor libero commodi blanditiis omnis,True
2,35,repellendus veritatis molestias dicta incidunt,True
2,36,excepturi deleniti adipisci voluptatem et neque optio illum ad,True
2,40,totam atque quo nesciunt,True
3,43,tempore ut sint quis recusandae,True
3,44,cum debitis quis accusamus doloremque ipsa natus sapiente omnis,True
3,50,cupiditate necessitatibus ullam aut quis dolor voluptate,True
3,54,quis et est ut voluptate quam dolor,True
3,55,voluptatum omnis minima qui occaecati provident nulla voluptatem ratione,True
3,56,deleniti ea temporibus enim,True
3,60,et sequi qui architecto ut adipisci,True
4,61,odit optio omnis qui sunt,True
4,63,doloremque aut dolores quidem fuga qui nulla,True
4,73,sint amet quia totam corporis qui exercitationem commodi,True
4,76,sequi dolorem sed,True
4,79,eum ipsa maxime ut,True
4,80,tempore molestias dolores rerum sequi voluptates ipsum consequatur,True
5,81,suscipit qui totam,True
5,83,quidem at rerum quis ex aut sit quam,True
5,85,et quia ad iste a,True
5,86,incidunt ut saepe autem,True
5,87,laudantium quae eligendi consequatur quia et vero autem,True
5,89,sequi ut omnis et,True
5,90,molestiae nisi accusantium tenetur dolorem et,True
5,91,nulla quis consequatur saepe qui id expedita,True
5,92,in omnis laboriosam,True
5,93,odio iure consequatur molestiae quibusdam necessitatibus quia sint,True
5,95,vel nihil et molestiae iusto assumenda nemo quo ut,True
5,98,debitis accusantium ut quo facilis nihil quis sapiente necessitatibus,True
6,105,totam quia dolorem et illum repellat voluptas optio,True
6,106,ad illo quis voluptatem temporibus,True
6,108,a eos eaque nihil et exercitationem incidunt delectus,True
6,109,autem temporibus harum quisquam in culpa,True
6,110,aut aut ea corporis,True
6,116,ipsa dolores vel facilis ut,True
7,121,inventore aut nihil minima laudantium hic qui omnis,True
7,122,provident aut nobis culpa,True
7,126,ut asperiores perspiciatis veniam ipsum rerum saepe,True
7,127,voluptatem libero consectetur rerum ut,True
7,130,nulla aliquid eveniet harum laborum libero alias ut unde,True
7,132,qui molestiae voluptatibus velit iure harum quisquam,True
7,133,et labore eos enim rerum consequatur sunt,True
7,138,placeat minima consequatur rem qui ut,True
7,140,aut consectetur in blanditiis deserunt quia sed laboriosam,True
8,141,explicabo consectetur debitis voluptates quas quae culpa rerum non,True
8,142,maiores accusantium architecto necessitatibus reiciendis ea aut,True
8,146,molestiae suscipit ratione nihil odio libero impedit vero totam,True
8,147,eum itaque quod reprehenderit et facilis dolor autem ut,True
8,151,accusamus adipisci dicta qui quo ea explicabo sed vero,True
8,154,rerum non ex sapiente,True
8,155,voluptatem nobis consequatur et assumenda magnam,True
8,156,nam quia quia nulla repellat assumenda quibusdam sit nobis,True
8,157,dolorem veniam quisquam deserunt repellendus,True
8,158,debitis vitae delectus et harum accusamus aut deleniti a,True
8,159,debitis adipisci quibusdam aliquam sed dolore ea praesentium nobis,True
9,161,ex hic consequuntur earum omnis alias ut occaecati culpa,True
9,162,omnis laboriosam molestias animi sunt dolore,True
9,169,ea odio perferendis officiis,True
9,171,fugiat aut voluptatibus corrupti deleniti velit iste odio,True
9,175,laudantium eius officia perferendis provident perspiciatis asperiores,True
9,178,nesciunt itaque commodi tempore,True
9,179,omnis consequuntur cupiditate impedit itaque ipsam quo,True
9,180,debitis nisi et dolorem repellat et,True
10,182,inventore saepe cumque et aut illum enim,True
10,183,omnis nulla eum aliquam distinctio,True
10,188,vel non beatae est,True
10,189,culpa eius et voluptatem et,True
10,190,accusamus sint iusto et voluptatem exercitationem,True
10,191,temporibus atque distinctio omnis eius impedit tempore molestias pariatur,True
10,193,rerum debitis voluptatem qui eveniet tempora distinctio a,True
10,195,rerum ex veniam mollitia voluptatibus pariatur,True
10,196,consequuntur aut ut fugit similique,True
10,197,dignissimos quo nobis earum saepe,True
10,198,quis eius est sint explicabo,True
10,199,numquam repellendus a magnam,True
